mysql> create table customers(customer_id int primary key,name varchar(100) not null,email varchar(100) unique,phone varchar(15),city varchar(255),registration_date date);
Query OK, 0 rows affected (0.05 sec)

mysql>  insert into customers values(1,'jeshwitha','jeshwitha@gmail.com','8367047033','hyderabad','2025-01-10'),(2,'sukanya','sukanya@gmail.com','8377047033','chennai','2025-02-15'),(3,'swathi','swathi@gmail.com','8367047032','hyderabad','2025-03-20'),(4,'rakesh','rakesh@gmail.com','7392429476','chennai','2025-06-10'),(5,'sai','sai@gmail.com','7993567594','hyderabad','2025-07-10'),(6,'mounika','mounika@gmail.com','9392854842','banglore','2025-08-05'),(7,'abdulla','abdulla@gmail.com','9948944874','chennai','2025-09-01'),(8,'gowthami','gowthami@gmail.com','9573183442','mumbai','2025-11-20'),(9,'shushma','shushma@gmail.com','9550441141','hyderabad','2025-12-28'),(10,'madhuri','madhuri@gmail.com','8367085798','mumbai','2025-05-25');
Query OK, 10 rows affected (0.02 sec)
Records: 10  Duplicates: 0  Warnings: 0

mysql> create table categories(category_id int primary key,category_name varchar(100) not null,description varchar(255));
Query OK, 0 rows affected (0.03 sec)

mysql> insert into categories values(1, 'Electronics', 'Electronic devices and accessories'),(2, 'Clothing', 'Men and women clothing'),(3, 'Books', 'Educational and general books'),(4, 'Home Appliances', 'Home and kitchen appliances'),(5, 'Sports', 'Sports and fitness products');
Query OK, 5 rows affected (0.01 sec)
Records: 5  Duplicates: 0  Warnings: 0

mysql> create table products(product_id int primary key,product_name varchar(100) not null,price decimal(10,2),stock_quantity int,category_id int,add_date date,foreign key (category_id) references categories(category_id));
Query OK, 0 rows affected (0.06 sec)

mysql> insert into products values(101, 'Laptop', 55000, 10, 1, '2025-01-10'), (102, 'Smartphone', 25000, 20, 1, '2025-02-15'), (103, 'Headphones', 1500, 50, 1, '2025-03-20'), (104, 'T-Shirt', 800, 40, 2, '2025-04-10'), (105, 'Jeans', 1800, 30, 2, '2025-05-25'), (106, 'SQL Book', 1200, 25, 3, '2025-06-10'), (107, 'Mixer Grinder', 3500, 15, 4, '2025-07-10'), (108, 'Running Shoes', 2800, 20, 5, '2025-08-05'), (109, 'Smart Watch', 4500, 18, 1, '2025-09-01'), (110, 'Python Book', 1000, 30, 3, '2025-09-20'), (111, 'Table Lamp', 900, 25, 4, '2025-11-20'), (112, 'Cricket Bat', 2200, 12, 5, '2025-12-28');
Query OK, 12 rows affected (0.01 sec)
Records: 12  Duplicates: 0  Warnings: 0

mysql> create table orders(order_id int primary key,customer_id int,order_date date,total_amount decimal(10,2),status varchar(20),foreign key (customer_id) references customers(customer_id));
Query OK, 0 rows affected (0.05 sec)

mysql> insert into orders values(1001, 1, '2026-01-05', 55000, 'Completed'),(1002, 2, '2026-01-15', 26500, 'Completed'),(1003, 3, '2026-02-10', 4000, 'Completed'),(1004, 1, '2026-02-20', 4500, 'Completed'),(1005, 4, '2026-03-05', 3500, 'Completed'),(1006, 5, '2026-03-15', 2800, 'Completed'),(1007, 3, '2026-04-10', 1200, 'Cancelled'),(1008, 2, '2026-04-20', 25000, 'Completed'),(1009, 6, '2026-05-05', 7000, 'Completed'),(1010, 1, '2026-05-20', 4500, 'Completed');
Query OK, 10 rows affected (0.01 sec)
Records: 10  Duplicates: 0  Warnings: 0

mysql>  create table order_items(order_item_id int primary key,order_id int,product_id int,quantity int,price decimal(10,2),subtotal decimal(10,2),foreign key(order_id) references orders(order_id),foreign key(product_id) references products(product_id));
Query OK, 0 rows affected (0.05 sec)

mysql> insert into order_items values(1, 1001, 101, 1, 55000, 55000),(2, 1002, 102, 1, 25000, 25000),(3, 1002, 103, 1, 1500, 1500),(4, 1003, 103, 2, 1500, 3000),(5, 1003, 104, 1, 800, 800),(6, 1004, 109, 1, 4500, 4500),(7, 1005, 107, 1, 3500, 3500),(8, 1006, 108, 1, 2800, 2800),(9, 1007, 106, 1, 1200, 1200),(10, 1008, 102, 1, 25000, 25000),(11, 1009, 107, 2, 3500, 7000),(12, 1010, 109, 1, 4500, 4500);
Query OK, 12 rows affected (0.01 sec)
Records: 12  Duplicates: 0  Warnings: 0

mysql> select * from products where price > 1000;
+------------+---------------+----------+----------------+-------------+------------+
| product_id | product_name  | price    | stock_quantity | category_id | add_date   |
+------------+---------------+----------+----------------+-------------+------------+
|        101 | Laptop        | 55000.00 |             10 |           1 | 2025-01-10 |
|        102 | Smartphone    | 25000.00 |             20 |           1 | 2025-02-15 |
|        103 | Headphones    |  1500.00 |             50 |           1 | 2025-03-20 |
|        105 | Jeans         |  1800.00 |             30 |           2 | 2025-05-25 |
|        106 | SQL Book      |  1200.00 |             25 |           3 | 2025-06-10 |
|        107 | Mixer Grinder |  3500.00 |             15 |           4 | 2025-07-10 |
|        108 | Running Shoes |  2800.00 |             20 |           5 | 2025-08-05 |
|        109 | Smart Watch   |  4500.00 |             18 |           1 | 2025-09-01 |
|        112 | Cricket Bat   |  2200.00 |             12 |           5 | 2025-12-28 |
+------------+---------------+----------+----------------+-------------+------------+
9 rows in set (0.01 sec)

mysql>  select * from customers where city='hyderabad';
+-------------+-----------+---------------------+------------+-----------+-------------------+
| customer_id | name      | email               | phone      | city      | registration_date |
+-------------+-----------+---------------------+------------+-----------+-------------------+
|           1 | jeshwitha | jeshwitha@gmail.com | 8367047033 | hyderabad | 2025-01-10        |
|           3 | swathi    | swathi@gmail.com    | 8367047032 | hyderabad | 2025-03-20        |
|           5 | sai       | sai@gmail.com       | 7993567594 | hyderabad | 2025-07-10        |
|           9 | shushma   | shushma@gmail.com   | 9550441141 | hyderabad | 2025-12-28        |
+-------------+-----------+---------------------+------------+-----------+-------------------+
4 rows in set (0.00 sec)

mysql> select p.* from products p join categories c on p.category_id=c.category_id where c.category_name ='Electronics';
+------------+--------------+----------+----------------+-------------+------------+
| product_id | product_name | price    | stock_quantity | category_id | add_date   |
+------------+--------------+----------+----------------+-------------+------------+
|        101 | Laptop       | 55000.00 |             10 |           1 | 2025-01-10 |
|        102 | Smartphone   | 25000.00 |             20 |           1 | 2025-02-15 |
|        103 | Headphones   |  1500.00 |             50 |           1 | 2025-03-20 |
|        109 | Smart Watch  |  4500.00 |             18 |           1 | 2025-09-01 |
+------------+--------------+----------+----------------+-------------+------------+
4 rows in set (0.00 sec)

mysql> select * from products where price between 1000 and 5000;
+------------+---------------+---------+----------------+-------------+------------+
| product_id | product_name  | price   | stock_quantity | category_id | add_date   |
+------------+---------------+---------+----------------+-------------+------------+
|        103 | Headphones    | 1500.00 |             50 |           1 | 2025-03-20 |
|        105 | Jeans         | 1800.00 |             30 |           2 | 2025-05-25 |
|        106 | SQL Book      | 1200.00 |             25 |           3 | 2025-06-10 |
|        107 | Mixer Grinder | 3500.00 |             15 |           4 | 2025-07-10 |
|        108 | Running Shoes | 2800.00 |             20 |           5 | 2025-08-05 |
|        109 | Smart Watch   | 4500.00 |             18 |           1 | 2025-09-01 |
|        110 | Python Book   | 1000.00 |             30 |           3 | 2025-09-20 |
|        112 | Cricket Bat   | 2200.00 |             12 |           5 | 2025-12-28 |
+------------+---------------+---------+----------------+-------------+------------+
8 rows in set (0.00 sec)

mysql> select c.name,o.* from customers c join orders o on c.customer_id=o.customer_id;
+-----------+----------+-------------+------------+--------------+-----------+
| name      | order_id | customer_id | order_date | total_amount | status    |
+-----------+----------+-------------+------------+--------------+-----------+
| jeshwitha |     1001 |           1 | 2026-01-05 |     55000.00 | Completed |
| sukanya   |     1002 |           2 | 2026-01-15 |     26500.00 | Completed |
| swathi    |     1003 |           3 | 2026-02-10 |      4000.00 | Completed |
| jeshwitha |     1004 |           1 | 2026-02-20 |      4500.00 | Completed |
| rakesh    |     1005 |           4 | 2026-03-05 |      3500.00 | Completed |
| sai       |     1006 |           5 | 2026-03-15 |      2800.00 | Completed |
| swathi    |     1007 |           3 | 2026-04-10 |      1200.00 | Cancelled |
| sukanya   |     1008 |           2 | 2026-04-20 |     25000.00 | Completed |
| mounika   |     1009 |           6 | 2026-05-05 |      7000.00 | Completed |
| jeshwitha |     1010 |           1 | 2026-05-20 |      4500.00 | Completed |
+-----------+----------+-------------+------------+--------------+-----------+
10 rows in set (0.00 sec)

mysql> select p.product_name,i.quantity from products p join order_items i on p.product_id=i.product_id;
+---------------+----------+
| product_name  | quantity |
+---------------+----------+
| Laptop        |        1 |
| Smartphone    |        1 |
| Smartphone    |        1 |
| Headphones    |        1 |
| Headphones    |        2 |
| T-Shirt       |        1 |
| SQL Book      |        1 |
| Mixer Grinder |        1 |
| Mixer Grinder |        2 |
| Running Shoes |        1 |
| Smart Watch   |        1 |
| Smart Watch   |        1 |
+---------------+----------+
12 rows in set (0.00 sec)

mysql>  select o.order_id,o.order_date,o.total_amount,c.name,c.email,c.city from orders o join customers c on o.customer_id = c.customer_id;
+----------+------------+--------------+-----------+---------------------+-----------+
| order_id | order_date | total_amount | name      | email               | city      |
+----------+------------+--------------+-----------+---------------------+-----------+
|     1001 | 2026-01-05 |     55000.00 | jeshwitha | jeshwitha@gmail.com | hyderabad |
|     1002 | 2026-01-15 |     26500.00 | sukanya   | sukanya@gmail.com   | chennai   |
|     1003 | 2026-02-10 |      4000.00 | swathi    | swathi@gmail.com    | hyderabad |
|     1004 | 2026-02-20 |      4500.00 | jeshwitha | jeshwitha@gmail.com | hyderabad |
|     1005 | 2026-03-05 |      3500.00 | rakesh    | rakesh@gmail.com    | chennai   |
|     1006 | 2026-03-15 |      2800.00 | sai       | sai@gmail.com       | hyderabad |
|     1007 | 2026-04-10 |      1200.00 | swathi    | swathi@gmail.com    | hyderabad |
|     1008 | 2026-04-20 |     25000.00 | sukanya   | sukanya@gmail.com   | chennai   |
|     1009 | 2026-05-05 |      7000.00 | mounika   | mounika@gmail.com   | banglore  |
|     1010 | 2026-05-20 |      4500.00 | jeshwitha | jeshwitha@gmail.com | hyderabad |
+----------+------------+--------------+-----------+---------------------+-----------+
10 rows in set (0.00 sec)

mysql> select p.*,c.category_name from products p join categories c on p.category_id=c.category_id;
+------------+---------------+----------+----------------+-------------+------------+-----------------+
| product_id | product_name  | price    | stock_quantity | category_id | add_date   | category_name   |
+------------+---------------+----------+----------------+-------------+------------+-----------------+
|        101 | Laptop        | 55000.00 |             10 |           1 | 2025-01-10 | Electronics     |
|        102 | Smartphone    | 25000.00 |             20 |           1 | 2025-02-15 | Electronics     |
|        103 | Headphones    |  1500.00 |             50 |           1 | 2025-03-20 | Electronics     |
|        109 | Smart Watch   |  4500.00 |             18 |           1 | 2025-09-01 | Electronics     |
|        104 | T-Shirt       |   800.00 |             40 |           2 | 2025-04-10 | Clothing        |
|        105 | Jeans         |  1800.00 |             30 |           2 | 2025-05-25 | Clothing        |
|        106 | SQL Book      |  1200.00 |             25 |           3 | 2025-06-10 | Books           |
|        110 | Python Book   |  1000.00 |             30 |           3 | 2025-09-20 | Books           |
|        107 | Mixer Grinder |  3500.00 |             15 |           4 | 2025-07-10 | Home Appliances |
|        111 | Table Lamp    |   900.00 |             25 |           4 | 2025-11-20 | Home Appliances |
|        108 | Running Shoes |  2800.00 |             20 |           5 | 2025-08-05 | Sports          |
|        112 | Cricket Bat   |  2200.00 |             12 |           5 | 2025-12-28 | Sports          |
+------------+---------------+----------+----------------+-------------+------------+-----------------+
12 rows in set (0.00 sec)

mysql> select c.name,p.product_name,i.quantity from customers c join orders o on c.customer_id = o.customer_id join order_items i on o.order_id =i.order_id join products p on i.product_id=p.product_id;
+-----------+---------------+----------+
| name      | product_name  | quantity |
+-----------+---------------+----------+
| jeshwitha | Laptop        |        1 |
| jeshwitha | Smart Watch   |        1 |
| jeshwitha | Smart Watch   |        1 |
| sukanya   | Smartphone    |        1 |
| sukanya   | Headphones    |        1 |
| sukanya   | Smartphone    |        1 |
| swathi    | Headphones    |        2 |
| swathi    | T-Shirt       |        1 |
| swathi    | SQL Book      |        1 |
| rakesh    | Mixer Grinder |        1 |
| sai       | Running Shoes |        1 |
| mounika   | Mixer Grinder |        2 |
+-----------+---------------+----------+
12 rows in set (0.00 sec)

mysql> select count(*) as total_products from products;
+----------------+
| total_products |
+----------------+
|             12 |
+----------------+
1 row in set (0.00 sec)

mysql> select avg(price) as average_price from products;
+---------------+
| average_price |
+---------------+
|   8350.000000 |
+---------------+
1 row in set (0.00 sec)

mysql>  select sum(total_amount) as total_sales from orders;
+-------------+
| total_sales |
+-------------+
|   134000.00 |
+-------------+
1 row in set (0.00 sec)

mysql> select count(*) as total_orders from orders;
+--------------+
| total_orders |
+--------------+
|           10 |
+--------------+
1 row in set (0.00 sec)

mysql> select max(price) as highest_price from products;
+---------------+
| highest_price |
+---------------+
|      55000.00 |
+---------------+
1 row in set (0.00 sec)

mysql> select * from customers where customer_id not in (select customer_id from orders);
+-------------+----------+--------------------+------------+-----------+-------------------+
| customer_id | name     | email              | phone      | city      | registration_date |
+-------------+----------+--------------------+------------+-----------+-------------------+
|           7 | abdulla  | abdulla@gmail.com  | 9948944874 | chennai   | 2025-09-01        |
|           8 | gowthami | gowthami@gmail.com | 9573183442 | mumbai    | 2025-11-20        |
|           9 | shushma  | shushma@gmail.com  | 9550441141 | hyderabad | 2025-12-28        |
|          10 | madhuri  | madhuri@gmail.com  | 8367085798 | mumbai    | 2025-05-25        |
+-------------+----------+--------------------+------------+-----------+-------------------+
4 rows in set (0.00 sec)

mysql> select * from products where product_id not in (select product_id from order_items);
+------------+--------------+---------+----------------+-------------+------------+
| product_id | product_name | price   | stock_quantity | category_id | add_date   |
+------------+--------------+---------+----------------+-------------+------------+
|        105 | Jeans        | 1800.00 |             30 |           2 | 2025-05-25 |
|        110 | Python Book  | 1000.00 |             30 |           3 | 2025-09-20 |
|        111 | Table Lamp   |  900.00 |             25 |           4 | 2025-11-20 |
|        112 | Cricket Bat  | 2200.00 |             12 |           5 | 2025-12-28 |
+------------+--------------+---------+----------------+-------------+------------+
4 rows in set (0.00 sec)

mysql> select * from products where price > (select avg(price) from products);
+------------+--------------+----------+----------------+-------------+------------+
| product_id | product_name | price    | stock_quantity | category_id | add_date   |
+------------+--------------+----------+----------------+-------------+------------+
|        101 | Laptop       | 55000.00 |             10 |           1 | 2025-01-10 |
|        102 | Smartphone   | 25000.00 |             20 |           1 | 2025-02-15 |
+------------+--------------+----------+----------------+-------------+------------+
2 rows in set (0.00 sec)

mysql> select c.customer_id, c.name, sum(o.total_amount) as total_spending from customers c join orders o on c.customer_id = o.customer_id group by c.customer_id ,c.name having sum(o.total_amount) > (select avg(customer_total) from (select customer_id,sum(total_amount) as customer_total from orders group by customer_id) as customer_spending);
+-------------+-----------+----------------+
| customer_id | name      | total_spending |
+-------------+-----------+----------------+
|           1 | jeshwitha |       64000.00 |
|           2 | sukanya   |       51500.00 |
+-------------+-----------+----------------+
2 rows in set (0.01 sec)

mysql> select * from orders where total_amount > (select avg(total_amount) from orders);
+----------+-------------+------------+--------------+-----------+
| order_id | customer_id | order_date | total_amount | status    |
+----------+-------------+------------+--------------+-----------+
|     1001 |           1 | 2026-01-05 |     55000.00 | Completed |
|     1002 |           2 | 2026-01-15 |     26500.00 | Completed |
|     1008 |           2 | 2026-04-20 |     25000.00 | Completed |
+----------+-------------+------------+--------------+-----------+
3 rows in set (0.00 sec)

mysql> update products set price = 1600 where product_id=103;
Query OK, 1 row affected (0.01 sec)
Rows matched: 1  Changed: 1  Warnings: 0

mysql>  select * from products;
+------------+---------------+----------+----------------+-------------+------------+
| product_id | product_name  | price    | stock_quantity | category_id | add_date   |
+------------+---------------+----------+----------------+-------------+------------+
|        101 | Laptop        | 55000.00 |             10 |           1 | 2025-01-10 |
|        102 | Smartphone    | 25000.00 |             20 |           1 | 2025-02-15 |
|        103 | Headphones    |  1600.00 |             50 |           1 | 2025-03-20 |
|        104 | T-Shirt       |   800.00 |             40 |           2 | 2025-04-10 |
|        105 | Jeans         |  1800.00 |             30 |           2 | 2025-05-25 |
|        106 | SQL Book      |  1200.00 |             25 |           3 | 2025-06-10 |
|        107 | Mixer Grinder |  3500.00 |             15 |           4 | 2025-07-10 |
|        108 | Running Shoes |  2800.00 |             20 |           5 | 2025-08-05 |
|        109 | Smart Watch   |  4500.00 |             18 |           1 | 2025-09-01 |
|        110 | Python Book   |  1000.00 |             30 |           3 | 2025-09-20 |
|        111 | Table Lamp    |   900.00 |             25 |           4 | 2025-11-20 |
|        112 | Cricket Bat   |  2200.00 |             12 |           5 | 2025-12-28 |
+------------+---------------+----------+----------------+-------------+------------+
12 rows in set (0.00 sec)

mysql> update customers set email='sukanya12@gamail.com' where customer_id=1;
Query OK, 1 row affected (0.01 sec)
Rows matched: 1  Changed: 1  Warnings: 0

mysql> select * from customers;
+-------------+-----------+----------------------+------------+-----------+-------------------+
| customer_id | name      | email                | phone      | city      | registration_date |
+-------------+-----------+----------------------+------------+-----------+-------------------+
|           1 | jeshwitha | sukanya12@gamail.com | 8367047033 | hyderabad | 2025-01-10        |
|           2 | sukanya   | sukanya@gmail.com    | 8377047033 | chennai   | 2025-02-15        |
|           3 | swathi    | swathi@gmail.com     | 8367047032 | hyderabad | 2025-03-20        |
|           4 | rakesh    | rakesh@gmail.com     | 7392429476 | chennai   | 2025-06-10        |
|           5 | sai       | sai@gmail.com        | 7993567594 | hyderabad | 2025-07-10        |
|           6 | mounika   | mounika@gmail.com    | 9392854842 | banglore  | 2025-08-05        |
|           7 | abdulla   | abdulla@gmail.com    | 9948944874 | chennai   | 2025-09-01        |
|           8 | gowthami  | gowthami@gmail.com   | 9573183442 | mumbai    | 2025-11-20        |
|           9 | shushma   | shushma@gmail.com    | 9550441141 | hyderabad | 2025-12-28        |
|          10 | madhuri   | madhuri@gmail.com    | 8367085798 | mumbai    | 2025-05-25        |
+-------------+-----------+----------------------+------------+-----------+-------------------+
10 rows in set (0.00 sec)

mysql> update products set category_id = 3 where product_id=104;
Query OK, 1 row affected (0.01 sec)
Rows matched: 1  Changed: 1  Warnings: 0

mysql> select * from products;
+------------+---------------+----------+----------------+-------------+------------+
| product_id | product_name  | price    | stock_quantity | category_id | add_date   |
+------------+---------------+----------+----------------+-------------+------------+
|        101 | Laptop        | 55000.00 |             10 |           1 | 2025-01-10 |
|        102 | Smartphone    | 25000.00 |             20 |           1 | 2025-02-15 |
|        103 | Headphones    |  1600.00 |             50 |           1 | 2025-03-20 |
|        104 | T-Shirt       |   800.00 |             40 |           3 | 2025-04-10 |
|        105 | Jeans         |  1800.00 |             30 |           2 | 2025-05-25 |
|        106 | SQL Book      |  1200.00 |             25 |           3 | 2025-06-10 |
|        107 | Mixer Grinder |  3500.00 |             15 |           4 | 2025-07-10 |
|        108 | Running Shoes |  2800.00 |             20 |           5 | 2025-08-05 |
|        109 | Smart Watch   |  4500.00 |             18 |           1 | 2025-09-01 |
|        110 | Python Book   |  1000.00 |             30 |           3 | 2025-09-20 |
|        111 | Table Lamp    |   900.00 |             25 |           4 | 2025-11-20 |
|        112 | Cricket Bat   |  2200.00 |             12 |           5 | 2025-12-28 |
+------------+---------------+----------+----------------+-------------+------------+
12 rows in set (0.00 sec)

mysql> delete from order_items where order_id in (select order_id from orders where status='cancelled');
Query OK, 1 row affected (0.01 sec)

mysql> delete from orders where status='cancelled';
Query OK, 1 row affected (0.01 sec)

mysql> select * from orders;
+----------+-------------+------------+--------------+-----------+
| order_id | customer_id | order_date | total_amount | status    |
+----------+-------------+------------+--------------+-----------+
|     1001 |           1 | 2026-01-05 |     55000.00 | Completed |
|     1002 |           2 | 2026-01-15 |     26500.00 | Completed |
|     1003 |           3 | 2026-02-10 |      4000.00 | Completed |
|     1004 |           1 | 2026-02-20 |      4500.00 | Completed |
|     1005 |           4 | 2026-03-05 |      3500.00 | Completed |
|     1006 |           5 | 2026-03-15 |      2800.00 | Completed |
|     1008 |           2 | 2026-04-20 |     25000.00 | Completed |
|     1009 |           6 | 2026-05-05 |      7000.00 | Completed |
|     1010 |           1 | 2026-05-20 |      4500.00 | Completed |
+----------+-------------+------------+--------------+-----------+
9 rows in set (0.00 sec)

mysql> delete from customers where customer_id not in (select customer_id from orders);
Query OK, 4 rows affected (0.01 sec)

mysql> select * from customers;
+-------------+-----------+----------------------+------------+-----------+-------------------+
| customer_id | name      | email                | phone      | city      | registration_date |
+-------------+-----------+----------------------+------------+-----------+-------------------+
|           1 | jeshwitha | sukanya12@gamail.com | 8367047033 | hyderabad | 2025-01-10        |
|           2 | sukanya   | sukanya@gmail.com    | 8377047033 | chennai   | 2025-02-15        |
|           3 | swathi    | swathi@gmail.com     | 8367047032 | hyderabad | 2025-03-20        |
|           4 | rakesh    | rakesh@gmail.com     | 7392429476 | chennai   | 2025-06-10        |
|           5 | sai       | sai@gmail.com        | 7993567594 | hyderabad | 2025-07-10        |
|           6 | mounika   | mounika@gmail.com    | 9392854842 | banglore  | 2025-08-05        |
+-------------+-----------+----------------------+------------+-----------+-------------------+
6 rows in set (0.00 sec)

mysql> create view customer_orders as select c.customer_id,c.name,o.order_id,o.order_date,o.total_amount,o.status from customers c join orders o on c.customer_id=o.customer_id;
Query OK, 0 rows affected (0.01 sec)

mysql>  select * from customer_orders;
+-------------+-----------+----------+------------+--------------+-----------+
| customer_id | name      | order_id | order_date | total_amount | status    |
+-------------+-----------+----------+------------+--------------+-----------+
|           1 | jeshwitha |     1001 | 2026-01-05 |     55000.00 | Completed |
|           2 | sukanya   |     1002 | 2026-01-15 |     26500.00 | Completed |
|           3 | swathi    |     1003 | 2026-02-10 |      4000.00 | Completed |
|           1 | jeshwitha |     1004 | 2026-02-20 |      4500.00 | Completed |
|           4 | rakesh    |     1005 | 2026-03-05 |      3500.00 | Completed |
|           5 | sai       |     1006 | 2026-03-15 |      2800.00 | Completed |
|           2 | sukanya   |     1008 | 2026-04-20 |     25000.00 | Completed |
|           6 | mounika   |     1009 | 2026-05-05 |      7000.00 | Completed |
|           1 | jeshwitha |     1010 | 2026-05-20 |      4500.00 | Completed |
+-------------+-----------+----------+------------+--------------+-----------+
9 rows in set (0.00 sec)

mysql>  create view product_details as select p.product_id,p.product_name,p.price,p.stock_quantity,c.category_name from products p join categories c on p.category_id=c.category_id;
Query OK, 0 rows affected (0.01 sec)

mysql>  select * from product_details;
+------------+---------------+----------+----------------+-----------------+
| product_id | product_name  | price    | stock_quantity | category_name   |
+------------+---------------+----------+----------------+-----------------+
|        101 | Laptop        | 55000.00 |             10 | Electronics     |
|        102 | Smartphone    | 25000.00 |             20 | Electronics     |
|        103 | Headphones    |  1600.00 |             50 | Electronics     |
|        109 | Smart Watch   |  4500.00 |             18 | Electronics     |
|        105 | Jeans         |  1800.00 |             30 | Clothing        |
|        104 | T-Shirt       |   800.00 |             40 | Books           |
|        106 | SQL Book      |  1200.00 |             25 | Books           |
|        110 | Python Book   |  1000.00 |             30 | Books           |
|        107 | Mixer Grinder |  3500.00 |             15 | Home Appliances |
|        111 | Table Lamp    |   900.00 |             25 | Home Appliances |
|        108 | Running Shoes |  2800.00 |             20 | Sports          |
|        112 | Cricket Bat   |  2200.00 |             12 | Sports          |
+------------+---------------+----------+----------------+-----------------+
12 rows in set (0.00 sec)

mysql> create view order_item_details as select i.order_item_id,i.order_id,p.product_name,i.quantity,i.price,i.subtotal from order_items i join products p on i.product_id=p.product_id;
Query OK, 0 rows affected (0.01 sec)

mysql> select * from order_item_details;
+---------------+----------+---------------+----------+----------+----------+
| order_item_id | order_id | product_name  | quantity | price    | subtotal |
+---------------+----------+---------------+----------+----------+----------+
|             1 |     1001 | Laptop        |        1 | 55000.00 | 55000.00 |
|             2 |     1002 | Smartphone    |        1 | 25000.00 | 25000.00 |
|             3 |     1002 | Headphones    |        1 |  1500.00 |  1500.00 |
|             4 |     1003 | Headphones    |        2 |  1500.00 |  3000.00 |
|             5 |     1003 | T-Shirt       |        1 |   800.00 |   800.00 |
|             6 |     1004 | Smart Watch   |        1 |  4500.00 |  4500.00 |
|             7 |     1005 | Mixer Grinder |        1 |  3500.00 |  3500.00 |
|             8 |     1006 | Running Shoes |        1 |  2800.00 |  2800.00 |
|            10 |     1008 | Smartphone    |        1 | 25000.00 | 25000.00 |
|            11 |     1009 | Mixer Grinder |        2 |  3500.00 |  7000.00 |
|            12 |     1010 | Smart Watch   |        1 |  4500.00 |  4500.00 |
+---------------+----------+---------------+----------+----------+----------+
11 rows in set (0.00 sec)

mysql> create view customer_total_spending as select c.customer_id,c.name,sum(o.total_amount) as total_spending from customers c join orders o on c.customer_id=o.customer_id group by c.customer_id,c.name;
Query OK, 0 rows affected (0.01 sec)

mysql> select * from customer_total_spending;
+-------------+-----------+----------------+
| customer_id | name      | total_spending |
+-------------+-----------+----------------+
|           1 | jeshwitha |       64000.00 |
|           2 | sukanya   |       51500.00 |
|           3 | swathi    |        4000.00 |
|           4 | rakesh    |        3500.00 |
|           5 | sai       |        2800.00 |
|           6 | mounika   |        7000.00 |
+-------------+-----------+----------------+
6 rows in set (0.00 sec)

mysql> create view selling_products as select p.product_id,p.product_name,sum(i.quantity) as total_quantity_sold from products p join order_items i on p.product_id=i.product_id group by p.product_id,p.product_name;
Query OK, 0 rows affected (0.01 sec)

mysql> select * from selling_products;
+------------+---------------+---------------------+
| product_id | product_name  | total_quantity_sold |
+------------+---------------+---------------------+
|        101 | Laptop        |                   1 |
|        102 | Smartphone    |                   2 |
|        103 | Headphones    |                   3 |
|        104 | T-Shirt       |                   1 |
|        109 | Smart Watch   |                   2 |
|        107 | Mixer Grinder |                   3 |
|        108 | Running Shoes |                   1 |
+------------+---------------+---------------------+
7 rows in set (0.00 sec)

mysql> delimiter //
mysql> mysql> create procedure insert_new_customer(in p_customer_id int,in p_name varchar(100),in p_email varchar(100),in p_phone varchar(15),in p_city varchar(255),in p_registration_date date)
    ->     -> begin
    ->     -> insert into customers values(p_customer_id,p_name,p_email,p_phone,p_city,p_registration_date);
    ->     -> end //
ERROR 1064 (42000): You have an error in your SQL syntax; check the manual that corresponds to your MySQL server version for the right syntax to use near 'mysql> create procedure insert_new_customer(in p_customer_id int,in p_name varch' at line 1
mysql> delimiter //
mysql> create procedure insert_new_customer(in p_customer_id int,in p_name varchar(100),in p_email varchar(100),in p_phone varchar(15),in p_city varchar(255),in p_registration_date date)
    -> begin
    -> insert into customers values(p_customer_id,p_name,p_email,p_phone,p_city,p_registration_date);
    -> end //
Query OK, 0 rows affected (0.03 sec)

mysql> delimiter ;
mysql> call insert_new_customer(9,'soumya','soumya@gmail.com','9948577952','mumbai','2025-06-02');
Query OK, 1 row affected (0.01 sec)

mysql> select * from customers;
+-------------+-----------+----------------------+------------+-----------+-------------------+
| customer_id | name      | email                | phone      | city      | registration_date |
+-------------+-----------+----------------------+------------+-----------+-------------------+
|           1 | jeshwitha | sukanya12@gamail.com | 8367047033 | hyderabad | 2025-01-10        |
|           2 | sukanya   | sukanya@gmail.com    | 8377047033 | chennai   | 2025-02-15        |
|           3 | swathi    | swathi@gmail.com     | 8367047032 | hyderabad | 2025-03-20        |
|           4 | rakesh    | rakesh@gmail.com     | 7392429476 | chennai   | 2025-06-10        |
|           5 | sai       | sai@gmail.com        | 7993567594 | hyderabad | 2025-07-10        |
|           6 | mounika   | mounika@gmail.com    | 9392854842 | banglore  | 2025-08-05        |
|           9 | soumya    | soumya@gmail.com     | 9948577952 | mumbai    | 2025-06-02        |
+-------------+-----------+----------------------+------------+-----------+-------------------+
7 rows in set (0.00 sec)

mysql> delimiter //
mysql> create procedure update_product_price(in p_product_id int,in p_new_price decimal(10,2))
    -> begin
    -> update products set price=p_new_price where product_id=p_product_id;
    -> end //
Query OK, 0 rows affected (0.01 sec)

mysql> delimiter ;
mysql> call update_product_price(103, 1700);
Query OK, 1 row affected (0.01 sec)

mysql> select * from products;
+------------+---------------+----------+----------------+-------------+------------+
| product_id | product_name  | price    | stock_quantity | category_id | add_date   |
+------------+---------------+----------+----------------+-------------+------------+
|        101 | Laptop        | 55000.00 |             10 |           1 | 2025-01-10 |
|        102 | Smartphone    | 25000.00 |             20 |           1 | 2025-02-15 |
|        103 | Headphones    |  1700.00 |             50 |           1 | 2025-03-20 |
|        104 | T-Shirt       |   800.00 |             40 |           3 | 2025-04-10 |
|        105 | Jeans         |  1800.00 |             30 |           2 | 2025-05-25 |
|        106 | SQL Book      |  1200.00 |             25 |           3 | 2025-06-10 |
|        107 | Mixer Grinder |  3500.00 |             15 |           4 | 2025-07-10 |
|        108 | Running Shoes |  2800.00 |             20 |           5 | 2025-08-05 |
|        109 | Smart Watch   |  4500.00 |             18 |           1 | 2025-09-01 |
|        110 | Python Book   |  1000.00 |             30 |           3 | 2025-09-20 |
|        111 | Table Lamp    |   900.00 |             25 |           4 | 2025-11-20 |
|        112 | Cricket Bat   |  2200.00 |             12 |           5 | 2025-12-28 |
+------------+---------------+----------+----------------+-------------+------------+
12 rows in set (0.00 sec)

mysql> delimiter //
mysql> create procedure customer_orders_list(in p_customer_id int)
    -> begin
    -> select * from orders where customer_id=p_customer_id;
    -> end //
Query OK, 0 rows affected (0.01 sec)

mysql> delimiter ;
mysql>  call customer_orders_list(1);
+----------+-------------+------------+--------------+-----------+
| order_id | customer_id | order_date | total_amount | status    |
+----------+-------------+------------+--------------+-----------+
|     1001 |           1 | 2026-01-05 |     55000.00 | Completed |
|     1004 |           1 | 2026-02-20 |      4500.00 | Completed |
|     1010 |           1 | 2026-05-20 |      4500.00 | Completed |
+----------+-------------+------------+--------------+-----------+
3 rows in set (0.00 sec)

Query OK, 0 rows affected (0.01 sec)

mysql> delimiter //
mysql> create procedure total_sales()
    -> begin
    -> select sum(total_amount) as total_sales from orders;
    -> end //
Query OK, 0 rows affected (0.01 sec)

mysql> delimiter ;
mysql> call total_sales();
+-------------+
| total_sales |
+-------------+
|   132800.00 |
+-------------+
1 row in set (0.00 sec)

Query OK, 0 rows affected (0.00 sec)

mysql> delimiter //
mysql> create procedure products_category(in p_category_id int)
    -> begin
    -> select * from products where category_id=p_category_id;
    -> end //
Query OK, 0 rows affected (0.01 sec)

mysql> delimiter ;
mysql> call products_category(1);
+------------+--------------+----------+----------------+-------------+------------+
| product_id | product_name | price    | stock_quantity | category_id | add_date   |
+------------+--------------+----------+----------------+-------------+------------+
|        101 | Laptop       | 55000.00 |             10 |           1 | 2025-01-10 |
|        102 | Smartphone   | 25000.00 |             20 |           1 | 2025-02-15 |
|        103 | Headphones   |  1700.00 |             50 |           1 | 2025-03-20 |
|        109 | Smart Watch  |  4500.00 |             18 |           1 | 2025-09-01 |
+------------+--------------+----------+----------------+-------------+------------+
4 rows in set (0.00 sec)

Query OK, 0 rows affected (0.02 sec)

mysql> select p.product_id,p.product_name,sum(i.quantity) as total_quantity from products p join order_items i on p.product_id=i.product_id group by p.product_id,p.product_name order by total_quantity desc limit 5;
+------------+---------------+----------------+
| product_id | product_name  | total_quantity |
+------------+---------------+----------------+
|        103 | Headphones    |              3 |
|        107 | Mixer Grinder |              3 |
|        102 | Smartphone    |              2 |
|        109 | Smart Watch   |              2 |
|        101 | Laptop        |              1 |
+------------+---------------+----------------+
5 rows in set (0.00 sec)

mysql> select c.customer_id,c.name,count(o.order_id) as total_orders from customers c join orders o on c.customer_id=o.customer_id group by c.customer_id,c.name order by total_orders desc;
+-------------+-----------+--------------+
| customer_id | name      | total_orders |
+-------------+-----------+--------------+
|           1 | jeshwitha |            3 |
|           2 | sukanya   |            2 |
|           3 | swathi    |            1 |
|           4 | rakesh    |            1 |
|           5 | sai       |            1 |
|           6 | mounika   |            1 |
+-------------+-----------+--------------+
6 rows in set (0.00 sec)

mysql> select year(order_date) as year,month(order_date) as month,sum(total_amount) as monthly_sales from orders group by year(order_date),month(order_date) order by year,month;
+------+-------+---------------+
| year | month | monthly_sales |
+------+-------+---------------+
| 2026 |     1 |      81500.00 |
| 2026 |     2 |       8500.00 |
| 2026 |     3 |       6300.00 |
| 2026 |     4 |      25000.00 |
| 2026 |     5 |      11500.00 |
+------+-------+---------------+
5 rows in set (0.00 sec)

mysql> select c.category_id,c.category_name,sum(i.subtotal) as total_revenue from categories c join products p on c.category_id=p.category_id join order_items i on p.product_id =i.product_id group by c.category_id ,c.category_name order by total_revenue desc limit 1;
+-------------+---------------+---------------+
| category_id | category_name | total_revenue |
+-------------+---------------+---------------+
|           1 | Electronics   |     118500.00 |
+-------------+---------------+---------------+
1 row in set (0.00 sec)

mysql> select c.customer_id,c.name,count(o.order_id) as total_orders,coalesce(sum(o.total_amount),0) as total_spending,coalesce(avg(o.total_amount),0) as average_order_value from customers c left join orders o on c.customer_id=o.customer_id group by c.customer_id,c.name order by total_spending desc;
+-------------+-----------+--------------+----------------+---------------------+
| customer_id | name      | total_orders | total_spending | average_order_value |
+-------------+-----------+--------------+----------------+---------------------+
|           1 | jeshwitha |            3 |       64000.00 |        21333.333333 |
|           2 | sukanya   |            2 |       51500.00 |        25750.000000 |
|           6 | mounika   |            1 |        7000.00 |         7000.000000 |
|           3 | swathi    |            1 |        4000.00 |         4000.000000 |
|           4 | rakesh    |            1 |        3500.00 |         3500.000000 |
|           5 | sai       |            1 |        2800.00 |         2800.000000 |
|           9 | soumya    |            0 |           0.00 |            0.000000 |
+-------------+-----------+--------------+----------------+---------------------+
7 rows in set (0.00 sec)

mysql>